{
  "schemaVersion": 1,
  "id": "missing-description",
  "title": "A quiz without a description",
  "language": "en",
  "tags": ["web"],
  "questions": [
    {
      "id": "only-question",
      "type": "single-choice",
      "title": "Is this quiz publishable to the Catalog?",
      "explanation": "No — the Public catalog profile requires a `description`.",
      "options": [
        { "text": "Yes", "isCorrect": false },
        { "text": "No", "isCorrect": true }
      ]
    }
  ]
}
