{
  "schemaVersion": 1,
  "id": "css-layout",
  "title": "CSS layout fundamentals",
  "description": "Flexbox and grid basics.",
  "tags": ["css", "web"],
  "questions": [
    {
      "id": "flex-direction",
      "type": "single-choice",
      "title": "Which property sets the main axis of a flex container?",
      "explanation": "`flex-direction` defines the main axis along which flex items are laid out.",
      "options": [
        { "text": "flex-direction", "isCorrect": true },
        { "text": "justify-content", "isCorrect": false }
      ]
    }
  ]
}
