{
  "schemaVersion": 1,
  "id": "typescript-basics",
  "title": "TypeScript basics",
  "tags": ["typescript", "web"],
  "questions": [
    {
      "id": "narrowing",
      "type": "multiple-choice",
      "title": "Which of these narrow a union type?",
      "explanation": "`typeof` checks and the `in` operator are both narrowing guards.",
      "options": [
        { "text": "typeof checks", "isCorrect": true },
        { "text": "the in operator", "isCorrect": true },
        { "text": "console.log", "isCorrect": false }
      ]
    },
    {
      "id": "tuple-length",
      "type": "input",
      "title": "What is the length of the tuple type [string, number]?",
      "explanation": "A tuple type fixes its length; [string, number] always has length 2.",
      "validation": { "mode": "numeric", "acceptedAnswers": [2] }
    }
  ]
}
