{
  "schemaVersion": 1,
  "id": "all-question-types",
  "title": "All Question Types",
  "description": "A compact fixture that exercises every v1 Question type.",
  "language": "en-US",
  "tags": ["standard", "fixtures"],
  "author": "Quizbun",
  "questions": [
    {
      "id": "single",
      "title": "Which Option is correct?",
      "description": "Choose one Option.",
      "type": "single-choice",
      "options": [
        {
          "text": "Correct",
          "isCorrect": true
        },
        {
          "text": "Incorrect",
          "isCorrect": false
        }
      ],
      "explanation": "Exactly one Option is correct.",
      "references": "[Further reading](https://example.com/single-choice)"
    },
    {
      "id": "multiple",
      "title": "Which Options are correct?",
      "type": "multiple-choice",
      "options": [
        {
          "text": "First correct Option",
          "isCorrect": true
        },
        {
          "text": "Second correct Option",
          "isCorrect": true
        },
        {
          "text": "Incorrect Option",
          "isCorrect": false
        }
      ],
      "explanation": "Multiple-choice Questions can have more than one correct Option."
    },
    {
      "id": "input-numeric",
      "title": "How many bits are in a byte?",
      "type": "input",
      "validation": {
        "mode": "numeric",
        "acceptedAnswers": [8],
        "tolerance": 0
      },
      "explanation": "A byte contains 8 bits."
    }
  ]
}
