{
  "schemaVersion": 1,
  "id": "minimal-input-text",
  "title": "Minimal Input Text",
  "questions": [
    {
      "id": "name-pattern",
      "title": "What is the pattern called?",
      "type": "input",
      "validation": {
        "mode": "text",
        "acceptedAnswers": ["first conditional"],
        "caseSensitive": false
      },
      "explanation": "The accepted answer names the first conditional."
    }
  ]
}
