{
  "schemaVersion": 1,
  "id": "quiz-a",
  "title": "Quiz A",
  "questions": [
    {
      "id": "q1",
      "type": "single-choice",
      "title": "Question?",
      "explanation": "Because.",
      "options": [
        { "text": "Yes", "isCorrect": true },
        { "text": "No", "isCorrect": false }
      ]
    }
  ]
}
